{
  "review_queue_id": "gov_firmographic_genai_runtime_ent_ph_sec_as096_003241",
  "source_product": "firmographic_genai_runtime",
  "source_record_id": "genai_firmographic_ent_ph_sec_as096_003241",
  "resolved_entity_id": "ent_ph_sec_as096_003241",
  "crm_activation_key": null,
  "source_refs": "[\"src_neutral_ayala_20260425_annual_revenue\",\"src_research_research_doc_ayala_integrated_report_2024_annual_revenue\"]",
  "crm_activation_candidate_ids": "[\"001dM00003d4bllQAA\",\"001dM00003gR9K2QAK\"]",
  "crm_activation_candidate_names": "[\"Ayala Corporation\"]",
  "crm_activation_candidate_count": 2,
  "activation_resolution_hint": "ambiguous_crm_candidates_require_stewardship",
  "confidence_score": 0.7634,
  "confidence_components": "{\"source_reliability_score\":0.89,\"crm_anchor_score\":0.2}",
  "target_entity_name": null,
  "country_code": null,
  "market": null,
  "offering_family": null,
  "offer_bundle": null,
  "target_b2b_customer_ids": null,
  "target_b2b_customer_names": null,
  "recommended_next_actions": null,
  "review_priority": null,
  "freshness_status": "fresh",
  "activation_eligible_flag": false,
  "activation_block_reasons": "[\"missing_crm_activation_key\",\"source_product_not_activation_eligible\"]",
  "lineage_status": "source_bound",
  "model_id": "claude-sonnet-4-20250514",
  "prompt_version": "pulse360-public-regional-v1",
  "enrichment_run_id": "genai_firmographic_batch_llm_20260426044442",
  "source_run_timestamp": "2026-04-26T04:44:42Z",
  "ingestion_metadata_label": "Databricks activation review queue refresh - 2026-04-26",
  "run_id": "governance_evidence_run_20260426055300",
  "run_ts": "2026-04-26T05:53:00Z",
  "run_timestamp": "2026-04-26T05:53:00Z",
  "model_version": "account-intelligence-governance-evidence-v1"
}
